2023,2,G4,Allegiant Air,FAR,"Fargo, ND: Hector International",72.00,5.00,1.17,0.12,2.13,0.00,1.58,0.00,0.00,199.00,39.00,3.00,51.00,0.00,106.00
2023,2,G4,Allegiant Air,FAT,"Fresno, CA: Fresno Yosemite International",40.00,6.00,1.76,0.00,1.37,0.00,2.87,0.00,1.00,196.00,46.00,0.00,36.00,0.00,114.00
2023,2,G4,Allegiant Air,FCA,"Kalispell, MT: Glacier Park International",16.00,4.00,1.61,1.00,0.89,0.00,0.50,1.00,0.00,181.00,34.00,122.00,16.00,0.00,9.00
2023,2,G4,Allegiant Air,FLL,"Fort Lauderdale, FL: Fort Lauderdale-Hollywood International",239.00,68.00,9.54,3.35,32.33,0.00,22.78,3.00,0.00,3804.00,415.00,319.00,1523.00,0.00,1547.00
2023,2,G4,Allegiant Air,FNT,"Flint, MI: Bishop International",128.00,43.00,13.44,0.77,5.85,1.00,21.94,2.00,0.00,3261.00,1846.00,20.00,196.00,16.00,1183.00
2023,2,G4,Allegiant Air,FSD,"Sioux Falls, SD: Joe Foss Field",107.00,17.00,7.50,1.00,3.91,0.00,4.59,5.00,1.00,878.00,417.00,80.00,197.00,0.00,184.00
2023,2,G4,Allegiant Air,FWA,"Fort Wayne, IN: Fort Wayne International",67.00,8.00,1.92,0.63,4.71,0.00,0.73,0.00,0.00,348.00,57.00,17.00,230.00,0.00,44.00
2023,2,G4,Allegiant Air,GEG,"Spokane, WA: Spokane International",20.00,7.00,1.76,0.23,1.70,0.00,3.31,0.00,0.00,271.00,101.00,9.00,35.00,0.00,126.00
2023,2,G4,Allegiant Air,GFK,"Grand Forks, ND: Grand Forks International",22.00,5.00,1.94,0.00,2.08,0.00,0.98,0.00,0.00,302.00,201.00,0.00,50.00,0.00,51.00
2023,2,G4,Allegiant Air,GJT,"Grand Junction, CO: Grand Junction Regional",12.00,5.00,0.31,0.00,3.34,0.00,1.35,0.00,0.00,152.00,12.00,0.00,94.00,0.00,46.00
2023,2,G4,Allegiant Air,GRI,"Grand Island, NE: Central Nebraska Regional",16.00,2.00,0.08,0.00,1.00,0.00,0.92,0.00,0.00,79.00,5.00,0.00,18.00,0.00,56.00
2023,2,G4,Allegiant Air,GRR,"Grand Rapids, MI: Gerald R. Ford International",176.00,36.00,10.30,3.07,3.92,0.00,18.70,1.00,0.00,4614.00,440.00,2955.00,211.00,0.00,1008.00
2023,2,G4,Allegiant Air,GSO,"Greensboro/High Point, NC: Piedmont Triad International",8.00,1.00,0.00,0.00,0.00,0.00,1.00,0.00,0.00,54.00,0.00,0.00,0.00,0.00,54.00
2023,2,G4,Allegiant Air,GSP,"Greer, SC: Greenville-Spartanburg International",24.00,2.00,2.00,0.00,0.00,0.00,0.00,0.00,0.00,46.00,46.00,0.00,0.00,0.00,0.00
2023,2,G4,Allegiant Air,GTF,"Great Falls, MT: Great Falls International",16.00,3.00,1.00,0.42,0.15,0.00,1.42,0.00,0.00,153.00,19.00,30.00,11.00,0.00,93.00
2023,2,G4,Allegiant Air,HGR,"Hagerstown, MD: Hagerstown Regional-Richard A. Henson Field",16.00,3.00,0.00,1.00,1.00,0.00,1.00,0.00,0.00,68.00,0.00,31.00,19.00,0.00,18.00
2023,2,G4,Allegiant Air,HOU,"Houston, TX: William P Hobby",24.00,6.00,2.07,0.40,3.34,0.20,0.00,0.00,1.00,319.00,155.00,22.00,134.00,8.00,0.00
2023,2,G4,Allegiant Air,HTS,"Ashland, WV: Tri-State/Milton J. Ferguson Field",16.00,2.00,1.00,0.00,1.00,0.00,0.00,0.00,0.00,45.00,26.00,0.00,19.00,0.00,0.00
2023,2,G4,Allegiant Air,IAD,"Washington, DC: Washington Dulles International",40.00,6.00,1.97,1.77,1.26,0.00,1.00,0.00,0.00,897.00,334.00,370.00,91.00,0.00,102.00
2023,2,G4,Allegiant Air,IAG,"Niagara Falls, NY: Niagara Falls International",37.00,6.00,1.84,0.58,1.10,0.00,2.48,1.00,0.00,260.00,97.00,11.00,50.00,0.00,102.00
2023,2,G4,Allegiant Air,ICT,"Wichita, KS: Wichita Dwight D Eisenhower National",16.00,3.00,1.00,0.00,1.00,0.00,1.00,0.00,0.00,94.00,23.00,0.00,19.00,0.00,52.00
2023,2,G4,Allegiant Air,IDA,"Idaho Falls, ID: Idaho Falls Regional",26.00,8.00,1.16,0.00,1.64,0.00,5.20,0.00,0.00,646.00,280.00,0.00,36.00,0.00,330.00
2023,2,G4,Allegiant Air,IND,"Indianapolis, IN: Indianapolis International",84.00,11.00,0.88,0.73,2.42,0.00,6.96,0.00,0.00,404.00,34.00,11.00,55.00,0.00,304.00
2023,2,G4,Allegiant Air,JAX,"Jacksonville, FL: Jacksonville International",44.00,9.00,1.84,0.18,3.01,0.00,3.97,0.00,0.00,780.00,269.00,8.00,256.00,0.00,247.00
2023,2,G4,Allegiant Air,LAS,"Las Vegas, NV: Harry Reid International",610.00,201.00,28.53,6.73,98.65,0.40,66.69,3.00,1.00,12304.00,2093.00,1908.00,4081.00,91.00,4131.00
2023,2,G4,Allegiant Air,LAX,"Los Angeles, CA: Los Angeles International",47.00,6.00,1.00,0.00,3.90,0.00,1.11,0.00,2.00,349.00,40.00,0.00,149.00,0.00,160.00
2023,2,G4,Allegiant Air,LCK,"Columbus, OH: Rickenbacker International",49.00,5.00,0.88,0.00,0.60,0.00,3.52,0.00,0.00,206.00,58.00,0.00,23.00,0.00,125.00
2023,2,G4,Allegiant Air,LEX,"Lexington, KY: Blue Grass",36.00,8.00,1.52,1.00,1.95,0.00,3.53,0.00,0.00,420.00,69.00,77.00,62.00,0.00,212.00
2023,2,G4,Allegiant Air,LRD,"Laredo, TX: Laredo International",8.00,3.00,2.87,0.00,0.08,0.00,0.05,0.00,0.00,118.00,115.00,0.00,2.00,0.00,1.00
2023,2,G4,Allegiant Air,MCI,"Kansas City, MO: Kansas City International",12.00,1.00,0.88,0.00,0.12,0.00,0.00,0.00,1.00,43.00,38.00,0.00,5.00,0.00,0.00
2023,2,G4,Allegiant Air,MDT,"Harrisburg, PA: Harrisburg International",63.00,18.00,3.98,0.27,4.45,0.00,9.30,1.00,0.00,824.00,111.00,13.00,138.00,0.00,562.00
2023,2,G4,Allegiant Air,MDW,"Chicago, IL: Chicago Midway International",16.00,0.00,0.00,0.00,0.00,0.00,0.00,0.00,0.00,0.00,0.00,0.00,0.00,0.00,0.00
2023,2,G4,Allegiant Air,MEM,"Memphis, TN: Memphis International",58.00,8.00,1.94,1.07,3.27,0.00,1.73,0.00,0.00,625.00,277.00,194.00,94.00,0.00,60.00
2023,2,G4,Allegiant Air,MFE,"Mission/McAllen/Edinburg, TX: McAllen Miller International",36.00,6.00,1.90,1.00,1.94,0.00,1.16,0.00,0.00,225.00,100.00,19.00,37.00,0.00,69.00
2023,2,G4,Allegiant Air,MFR,"Medford, OR: Rogue Valley International - Medford",8.00,2.00,1.00,0.00,1.00,0.00,0.00,0.00,0.00,357.00,319.00,0.00,38.00,0.00,0.00
2023,2,G4,Allegiant Air,MLB,"Melbourne, FL: Melbourne Orlando International",18.00,5.00,1.00,0.00,0.00,0.00,4.00,0.00,0.00,244.00,21.00,0.00,0.00,0.00,223.00
2023,2,G4,Allegiant Air,MLI,"Moline, IL: Quad Cities International",38.00,4.00,4.00,0.00,0.00,0.00,0.00,0.00,0.00,385.00,385.00,0.00,0.00,0.00,0.00
2023,2,G4,Allegiant Air,MOT,"Minot, ND: Minot International",18.00,4.00,0.00,0.00,2.56,0.00,1.44,0.00,0.00,119.00,0.00,0.00,57.00,0.00,62.00
2023,2,G4,Allegiant Air,MRY,"Monterey, CA: Monterey Regional",8.00,3.00,0.35,0.57,0.35,0.00,1.73,0.00,0.00,123.00,13.00,21.00,14.00,0.00,75.00
2023,2,G4,Allegiant Air,MSO,"Missoula, MT: Missoula Montana",24.00,6.00,0.88,0.00,0.16,0.00,4.97,0.00,0.00,222.00,23.00,0.00,9.00,0.00,190.00
2023,2,G4,Allegiant Air,MSP,"Minneapolis, MN: Minneapolis-St Paul International",44.00,7.00,3.75,0.97,1.84,0.00,0.44,0.00,0.00,473.00,187.00,209.00,69.00,0.00,8.00
2023,2,G4,Allegiant Air,MSY,"New Orleans, LA: Louis Armstrong New Orleans International",8.00,1.00,1.00,0.00,0.00,0.00,0.00,0.00,0.00,38.00,38.00,0.00,0.00,0.00,0.00
2023,2,G4,Allegiant Air,MYR,"Myrtle Beach, SC: Myrtle Beach International",20.00,3.00,0.55,0.71,1.74,0.00,0.00,0.00,0.00,59.00,12.00,15.00,32.00,0.00,0.00
2023,2,G4,Allegiant Air,OAK,"Oakland, CA: Metro Oakland International",4.00,0.00,0.00,0.00,0.00,0.00,0.00,0.00,0.00,0.00,0.00,0.00,0.00,0.00,0.00
2023,2,G4,Allegiant Air,OKC,"Oklahoma City, OK: Will Rogers World",8.00,2.00,0.00,0.00,1.00,0.00,1.00,0.00,0.00,33.00,0.00,0.00,16.00,0.00,17.00
2023,2,G4,Allegiant Air,OMA,"Omaha, NE: Eppley Airfield",38.00,7.00,3.01,0.38,1.85,0.00,1.76,0.00,0.00,278.00,101.00,30.00,88.00,0.00,59.00
2023,2,G4,Allegiant Air,ORF,"Norfolk, VA: Norfolk International",12.00,5.00,1.88,0.00,0.05,0.00,3.07,0.00,0.00,538.00,156.00,0.00,3.00,0.00,379.00
2023,2,G4,Allegiant Air,OWB,"Owensboro, KY: Owensboro Daviess County Regional",8.00,2.00,1.45,0.00,0.55,0.00,0.00,0.00,0.00,852.00,830.00,0.00,22.00,0.00,0.00
2023,2,G4,Allegiant Air,PBG,"Plattsburgh, NY: Plattsburgh International",52.00,8.00,3.45,0.00,2.44,0.00,2.11,3.00,0.00,601.00,383.00,0.00,99.00,0.00,119.00
2023,2,G4,Allegiant Air,PBI,"West Palm Beach/Palm Beach, FL: Palm Beach International",36.00,10.00,0.40,0.00,8.00,0.00,1.60,0.00,0.00,493.00,6.00,0.00,433.00,0.00,54.00
2023,2,G4,Allegiant Air,PDX,"Portland, OR: Portland International",8.00,6.00,1.90,0.00,1.35,0.00,2.75,0.00,0.00,478.00,178.00,0.00,204.00,0.00,96.00
2023,2,G4,Allegiant Air,PGD,"Punta Gorda, FL: Punta Gorda Airport",561.00,114.00,25.60,11.66,38.92,2.00,35.83,4.00,0.00,9995.00,3206.00,1928.00,1721.00,63.00,3077.00
2023,2,G4,Allegiant Air,PHX,"Phoenix, AZ: Phoenix Sky Harbor International",28.00,8.00,1.13,0.00,3.76,0.91,2.21,0.00,1.00,304.00,42.00,0.00,119.00,58.00,85.00
2023,2,G4,Allegiant Air,PIA,"Peoria, IL: General Downing - Peoria International",76.00,13.00,4.38,1.85,6.47,0.00,0.30,0.00,0.00,603.00,194.00,149.00,251.00,0.00,9.00
2023,2,G4,Allegiant Air,PIE,"St. Petersburg, FL: St Pete Clearwater International",582.00,95.00,26.43,6.03,33.90,0.00,28.64,4.00,0.00,7838.00,3022.00,776.00,1569.00,0.00,2471.00
2023,2,G4,Allegiant Air,PIT,"Pittsburgh, PA: Pittsburgh International",72.00,15.00,4.76,0.11,3.97,0.00,6.17,0.00,0.00,471.00,133.00,4.00,92.00,0.00,242.00
2023,2,G4,Allegiant Air,PSC,"Pasco/Kennewick/Richland, WA: Tri Cities",20.00,3.00,1.00,0.00,0.61,0.00,1.39,0.00,0.00,119.00,67.00,0.00,19.00,0.00,33.00
2023,2,G4,Allegiant Air,PSM,"Portsmouth, NH: Portsmouth International at Pease",30.00,6.00,3.21,0.00,0.50,0.99,1.31,0.00,0.00,422.00,256.00,0.00,27.00,104.00,35.00
2023,2,G4,Allegiant Air,PSP,"Palm Springs, CA: Palm Springs International",20.00,5.00,0.00,0.88,2.56,0.00,1.56,0.00,0.00,358.00,0.00,129.00,125.00,0.00,104.00
2023,2,G4,Allegiant Air,PVD,"Providence, RI: Rhode Island Tf Green International",15.00,2.00,0.15,0.00,0.37,0.00,1.49,0.00,0.00,82.00,6.00,0.00,15.00,0.00,61.00
2023,2,G4,Allegiant Air,PVU,"Provo, UT: Provo Municipal",158.00,80.00,17.74,2.67,14.07,0.00,45.52,2.00,2.00,8044.00,2330.00,891.00,1949.00,0.00,2874.00
2023,2,G4,Allegiant Air,RAP,"Rapid City, SD: Rapid City Regional",20.00,5.00,3.16,0.00,1.07,0.00,0.78,0.00,0.00,442.00,326.00,0.00,70.00,0.00,46.00
2023,2,G4,Allegiant Air,RFD,"Rockford, IL: Chicago/Rockford International",61.00,10.00,3.45,0.00,4.52,0.00,2.03,3.00,0.00,1369.00,987.00,0.00,333.00,0.00,49.00
2023,2,G4,Allegiant Air,RIC,"Richmond, VA: Richmond International",44.00,5.00,1.82,0.00,0.33,0.00,2.85,1.00,0.00,436.00,164.00,0.00,39.00,0.00,233.00
2023,2,G4,Allegiant Air,RNO,"Reno, NV: Reno/Tahoe International",8.00,3.00,0.00,0.00,1.03,0.00,1.97,0.00,0.00,130.00,0.00,0.00,19.00,0.00,111.00
2023,2,G4,Allegiant Air,ROA,"Roanoke, VA: Roanoke Blacksburg Regional",20.00,2.00,1.99,0.00,0.01,0.00,0.00,0.00,1.00,146.00,145.00,0.00,1.00,0.00,0.00
2023,2,G4,Allegiant Air,ROC,"Rochester, NY: Frederick Douglass Grtr Rochester International",16.00,4.00,1.99,1.00,0.04,0.97,0.00,0.00,0.00,553.00,381.00,97.00,6.00,69.00,0.00
2023,2,G4,Allegiant Air,SAN,"San Diego, CA: San Diego International",16.00,7.00,1.24,0.77,2.81,0.00,2.19,0.00,0.00,404.00,115.00,79.00,100.00,0.00,110.00
2023,2,G4,Allegiant Air,SAT,"San Antonio, TX: San Antonio International",8.00,0.00,0.00,0.00,0.00,0.00,0.00,0.00,0.00,0.00,0.00,0.00,0.00,0.00,0.00
2023,2,G4,Allegiant Air,SAV,"Savannah, GA: Savannah/Hilton Head International",28.00,4.00,0.84,0.56,0.85,0.00,1.75,0.00,0.00,565.00,21.00,30.00,68.00,0.00,446.00
2023,2,G4,Allegiant Air,SBN,"South Bend, IN: South Bend International",64.00,10.00,3.17,2.00,0.86,0.00,3.97,0.00,1.00,1879.00,209.00,1461.00,30.00,0.00,179.00
2023,2,G4,Allegiant Air,SCK,"Stockton, CA: Stockton Metro",42.00,20.00,3.98,1.53,8.26,0.00,6.23,0.00,0.00,749.00,169.00,99.00,221.00,0.00,260.00
2023,2,G4,Allegiant Air,SDF,"Louisville, KY: Louisville Muhammad Ali International",44.00,5.00,1.86,0.93,0.90,0.00,1.32,0.00,0.00,295.00,140.00,25.00,96.00,0.00,34.00
2023,2,G4,Allegiant Air,SFB,"Sanford, FL: Orlando Sanford International",729.00,189.00,41.01,13.88,53.29,1.64,79.17,5.00,1.00,23416.00,5891.00,5288.00,3101.00,1477.00,7659.00
2023,2,G4,Allegiant Air,SGF,"Springfield, MO: Springfield-Branson National",44.00,9.00,3.52,0.00,2.26,0.00,3.22,0.00,0.00,484.00,199.00,0.00,48.00,0.00,237.00
2023,2,G4,Allegiant Air,SHV,"Shreveport, LA: Shreveport Regional",8.00,1.00,0.06,0.00,0.63,0.00,0.31,0.00,0.00,48.00,3.00,0.00,30.00,0.00,15.00
2023,2,G4,Allegiant Air,SMX,"Santa Maria, CA: Santa Maria Public/Capt. G. Allan Hancock Field",8.00,2.00,0.76,0.00,0.00,0.00,1.24,0.00,0.00,64.00,25.00,0.00,0.00,0.00,39.00
2023,2,G4,Allegiant Air,SNA,"Santa Ana, CA: John Wayne Airport-Orange County",72.00,27.00,6.86,1.00,11.32,0.42,7.39,0.00,0.00,1768.00,588.00,88.00,437.00,8.00,647.00
2023,2,G4,Allegiant Air,SPI,"Springfield, IL: Abraham Lincoln Capital",16.00,3.00,1.09,0.00,1.91,0.00,0.00,0.00,0.00,103.00,35.00,0.00,68.00,0.00,0.00
2023,2,G4,Allegiant Air,SRQ,"Sarasota/Bradenton, FL: Sarasota/Bradenton International",254.00,45.00,11.74,3.80,18.50,0.00,10.96,2.00,0.00,3580.00,657.00,1490.00,846.00,0.00,587.00
2023,2,G4,Allegiant Air,STC,"St. Cloud, MN: St. Cloud Regional",20.00,0.00,0.00,0.00,0.00,0.00,0.00,0.00,0.00,0.00,0.00,0.00,0.00,0.00,0.00
2023,2,G4,Allegiant Air,SWF,"Newburgh/Poughkeepsie, NY: New York Stewart International",28.00,4.00,1.07,0.28,0.00,0.00,2.65,0.00,0.00,162.00,41.00,10.00,0.00,0.00,111.00
2023,2,G4,Allegiant Air,SYR,"Syracuse, NY: Syracuse Hancock International",78.00,22.00,9.37,0.88,9.59,0.00,2.16,0.00,0.00,1192.00,658.00,54.00,365.00,0.00,115.00
2023,2,G4,Allegiant Air,TOL,"Toledo, OH: Eugene F Kranz Toledo Express",35.00,5.00,3.14,0.00,0.10,0.00,1.77,0.00,0.00,490.00,197.00,0.00,12.00,0.00,281.00
2023,2,G4,Allegiant Air,TRI,"Bristol/Johnson City/Kingsport, TN: Tri Cities",16.00,4.00,0.68,0.17,1.10,0.00,2.05,0.00,0.00,238.00,90.00,3.00,24.00,0.00,121.00
2023,2,G4,Allegiant Air,TUL,"Tulsa, OK: Tulsa International",22.00,2.00,0.95,0.00,1.05,0.00,0.00,0.00,0.00,78.00,53.00,0.00,25.00,0.00,0.00
2023,2,G4,Allegiant Air,TVC,"Traverse City, MI: Cherry Capital",24.00,2.00,1.00,0.00,1.00,0.00,0.00,0.00,2.00,41.00,24.00,0.00,17.00,0.00,0.00
2023,2,G4,Allegiant Air,TYS,"Knoxville, TN: McGhee Tyson",118.00,22.00,5.14,0.05,4.79,0.00,12.03,0.00,0.00,1401.00,382.00,11.00,202.00,0.00,806.00
2023,2,G4,Allegiant Air,USA,"Concord, NC: Concord Padgett Regional",60.00,10.00,3.31,1.00,2.63,0.00,3.05,1.00,0.00,378.00,109.00,36.00,60.00,0.00,173.00
2023,2,G4,Allegiant Air,VPS,"Valparaiso, FL: Eglin AFB Destin Fort Walton Beach",70.00,16.00,3.14,1.92,2.83,0.00,8.10,1.00,2.00,2466.00,187.00,1485.00,221.00,0.00,573.00
2023,2,G4,Allegiant Air,XNA,"Fayetteville, AR: Northwest Arkansas National",48.00,4.00,3.00,0.20,0.45,0.00,0.35,0.00,0.00,137.00,117.00,4.00,9.00,0.00,7.00
2023,2,HA,Hawaiian Airlines Inc.,AUS,"Austin, TX: Austin - Bergstrom International",12.00,4.00,1.00,2.36,0.00,0.00,0.64,0.00,0.00,1533.00,23.00,1482.00,0.00,0.00,28.00
2023,2,HA,Hawaiian Airlines Inc.,BOS,"Boston, MA: Logan International",18.00,6.00,4.49,0.00,0.00,0.00,1.51,0.00,0.00,177.00,114.00,0.00,0.00,0.00,63.00
2023,2,HA,Hawaiian Airlines Inc.,HNL,"Honolulu, HI: Daniel K Inouye International",2382.00,595.00,251.71,26.44,36.47,2.00,278.38,21.00,2.00,33645.00,14845.00,3554.00,1045.00,100.00,14101.00
2023,2,HA,Hawaiian Airlines Inc.,ITO,"Hilo, HI: Hilo International",349.00,95.00,48.39,4.33,1.43,0.00,40.85,2.00,1.00,3722.00,1589.00,341.00,38.00,0.00,1754.00
2023,2,HA,Hawaiian Airlines Inc.,JFK,"New York, NY: John F. Kennedy International",28.00,18.00,15.77,0.59,0.00,0.00,1.64,0.00,0.00,684.00,566.00,19.00,0.00,0.00,99.00
2023,2,HA,Hawaiian Airlines Inc.,KOA,"Kona, HI: Ellison Onizuka Kona International at Keahole",616.00,121.00,53.76,3.29,5.23,0.00,58.71,5.00,0.00,5091.00,2194.00,227.00,228.00,0.00,2442.00
2023,2,HA,Hawaiian Airlines Inc.,LAS,"Las Vegas, NV: Harry Reid International",108.00,34.00,32.00,0.00,0.00,0.00,2.00,0.00,0.00,1619.00,1587.00,0.00,0.00,0.00,32.00
2023,2,HA,Hawaiian Airlines Inc.,LAX,"Los Angeles, CA: Los Angeles International",168.00,44.00,40.62,0.00,0.00,0.00,3.38,1.00,2.00,2641.00,2042.00,0.00,0.00,0.00,599.00
2023,2,HA,Hawaiian Airlines Inc.,LGB,"Long Beach, CA: Long Beach Airport",56.00,26.00,21.69,1.67,0.00,0.00,2.64,0.00,0.00,922.00,760.00,51.00,0.00,0.00,111.00
2023,2,HA,Hawaiian Airlines Inc.,LIH,"Lihue, HI: Lihue Airport",644.00,135.00,75.04,10.21,3.45,0.00,46.29,4.00,0.00,6557.00,2934.00,584.00,114.00,0.00,2925.00
2023,2,HA,Hawaiian Airlines Inc.,OAK,"Oakland, CA: Metro Oakland International",84.00,32.00,26.53,0.35,0.00,0.38,4.74,1.00,1.00,1366.00,1152.00,25.00,0.00,8.00,181.00
2023,2,HA,Hawaiian Airlines Inc.,OGG,"Kahului, HI: Kahului Airport",1132.00,233.00,145.51,6.72,9.98,0.20,70.59,10.00,0.00,10392.00,6070.00,632.00,305.00,13.00,3372.00
2023,2,HA,Hawaiian Airlines Inc.,ONT,"Ontario, CA: Ontario International",28.00,17.00,14.14,0.00,0.00,0.00,2.86,0.00,0.00,608.00,511.00,0.00,0.00,0.00,97.00
2023,2,HA,Hawaiian Airlines Inc.,PDX,"Portland, OR: Portland International",56.00,32.00,25.50,3.55,0.00,0.00,2.95,0.00,0.00,1452.00,1050.00,284.00,0.00,0.00,118.00
2023,2,HA,Hawaiian Airlines Inc.,PHX,"Phoenix, AZ: Phoenix Sky Harbor International",28.00,7.00,5.00,1.00,0.00,0.00,1.00,0.00,1.00,515.00,401.00,37.00,0.00,0.00,77.00
2023,2,HA,Hawaiian Airlines Inc.,PPG,"Pago Pago, TT: Pago Pago International",8.00,3.00,2.88,0.00,0.00,0.00,0.13,0.00,0.00,150.00,138.00,0.00,0.00,0.00,12.00
2023,2,HA,Hawaiian Airlines Inc.,SAN,"San Diego, CA: San Diego International",56.00,32.00,25.19,0.26,0.44,0.29,5.81,0.00,0.00,1464.00,948.00,31.00,8.00,5.00,472.00
2023,2,HA,Hawaiian Airlines Inc.,SEA,"Seattle, WA: Seattle/Tacoma International",56.00,32.00,27.43,0.00,0.00,0.00,4.57,1.00,0.00,1366.00,1108.00,0.00,0.00,0.00,258.00
2023,2,HA,Hawaiian Airlines Inc.,SFO,"San Francisco, CA: San Francisco International",56.00,28.00,25.72,0.00,0.00,0.00,2.28,1.00,0.00,896.00,814.00,0.00,0.00,0.00,82.00
2023,2,HA,Hawaiian Airlines Inc.,SJC,"San Jose, CA: Norman Y. Mineta San Jose International",56.00,15.00,12.18,0.70,0.29,0.20,1.63,0.00,0.00,438.00,308.00,35.00,5.00,17.00,73.00
2023,2,HA,Hawaiian Airlines Inc.,SMF,"Sacramento, CA: Sacramento International",56.00,29.00,23.00,0.74,0.00,0.20,5.06,0.00,0.00,1074.00,734.00,20.00,0.00,4.00,316.00
2023,2,MQ,Envoy Air,ABE,"Allentown/Bethlehem/Easton, PA: Lehigh Valley International",26.00,2.00,0.00,1.43,0.57,0.00,0.00,0.00,0.00,90.00,0.00,61.00,29.00,0.00,0.00
2023,2,MQ,Envoy Air,ABI,"Abilene, TX: Abilene Regional",79.00,11.00,3.52,1.33,3.41,0.00,2.74,7.00,0.00,378.00,94.00,52.00,121.00,0.00,111.00
2023,2,MQ,Envoy Air,ABQ,"Albuquerque, NM: Albuquerque International Sunport",46.00,10.00,2.79,0.00,0.75,0.00,6.45,3.00,0.00,436.00,156.00,0.00,21.00,0.00,259.00
2023,2,MQ,Envoy Air,AGS,"Augusta, GA: Augusta Regional at Bush Field",52.00,7.00,0.39,0.00,2.98,0.00,3.63,1.00,0.00,414.00,37.00,0.00,106.00,0.00,271.00
2023,2,MQ,Envoy Air,ALO,"Waterloo, IA: Waterloo Regional",35.00,5.00,2.00,0.00,1.28,0.00,1.72,1.00,0.00,333.00,101.00,0.00,32.00,0.00,200.00
2023,2,MQ,Envoy Air,ATL,"Atlanta, GA: Hartsfield-Jackson Atlanta International",34.00,4.00,0.00,1.51,2.07,0.00,0.41,2.00,0.00,236.00,0.00,127.00,84.00,0.00,25.00
2023,2,MQ,Envoy Air,ATW,"Appleton, WI: Appleton International",83.00,22.00,7.73,1.60,9.05,0.00,3.62,4.00,0.00,1545.00,940.00,127.00,279.00,0.00,199.00
2023,2,MQ,Envoy Air,AUS,"Austin, TX: Austin - Bergstrom International",714.00,138.00,23.47,6.73,63.90,0.00,43.90,34.00,6.00,7377.00,1889.00,399.00,2203.00,0.00,2886.00
2023,2,MQ,Envoy Air,AVL,"Asheville, NC: Asheville Regional",28.00,0.00,0.00,0.00,0.00,0.00,0.00,2.00,0.00,0.00,0.00,0.00,0.00,0.00,0.00
2023,2,MQ,Envoy Air,AVP,"Scranton/Wilkes-Barre, PA: Wilkes Barre Scranton International",26.00,4.00,1.00,0.92,2.08,0.00,0.00,0.00,0.00,156.00,36.00,58.00,62.00,0.00,0.00
2023,2,MQ,Envoy Air,AZO,"Kalamazoo, MI: Kalamazoo/Battle Creek International",4.00,0.00,0.00,0.00,0.00,0.00,0.00,0.00,0.00,0.00,0.00,0.00,0.00,0.00,0.00
2023,2,MQ,Envoy Air,BDL,"Hartford, CT: Bradley International",11.00,1.00,0.12,0.00,0.00,0.00,0.88,0.00,0.00,33.00,4.00,0.00,0.00,0.00,29.00
2023,2,MQ,Envoy Air,BFL,"Bakersfield, CA: Meadows Field",54.00,11.00,2.39,0.00,3.29,0.00,5.32,1.00,0.00,658.00,158.00,0.00,85.00,0.00,415.00
2023,2,MQ,Envoy Air,BHM,"Birmingham, AL: Birmingham-Shuttlesworth International",128.00,18.00,6.32,1.94,5.96,0.00,3.78,2.00,0.00,799.00,244.00,50.00,199.00,0.00,306.00
2023,2,MQ,Envoy Air,BIL,"Billings, MT: Billings Logan International",54.00,4.00,3.00,0.00,1.00,0.00,0.00,3.00,0.00,172.00,97.00,0.00,75.00,0.00,0.00
2023,2,MQ,Envoy Air,BIS,"Bismarck/Mandan, ND: Bismarck Municipal",2.00,0.00,0.00,0.00,0.00,0.00,0.00,1.00,0.00,0.00,0.00,0.00,0.00,0.00,0.00
2023,2,MQ,Envoy Air,BMI,"Bloomington/Normal, IL: Central Il Regional Airport at Bloomington",29.00,3.00,0.47,0.00,0.93,0.00,1.60,0.00,0.00,264.00,82.00,0.00,26.00,0.00,156.00
2023,2,MQ,Envoy Air,BNA,"Nashville, TN: Nashville International",221.00,45.00,13.02,0.73,16.96,0.00,14.29,4.00,0.00,2013.00,537.00,52.00,612.00,0.00,812.00
2023,2,MQ,Envoy Air,BOS,"Boston, MA: Logan International",126.00,24.00,6.67,0.34,6.87,0.59,9.53,1.00,0.00,1602.00,336.00,11.00,363.00,10.00,882.00
2023,2,MQ,Envoy Air,BRO,"Brownsville, TX: Brownsville South Padre Island International",81.00,8.00,2.00,0.50,4.50,0.00,1.00,1.00,1.00,354.00,41.00,49.00,230.00,0.00,34.00
2023,2,MQ,Envoy Air,BTR,"Baton Rouge, LA: Baton Rouge Metropolitan/Ryan Field",79.00,14.00,4.41,1.20,7.34,0.00,1.06,3.00,0.00,558.00,222.00,56.00,206.00,0.00,74.00
2023,2,MQ,Envoy Air,BWI,"Baltimore, MD: Baltimore/Washington International Thurgood Marshall",29.00,5.00,0.00,1.00,2.29,0.00,1.71,1.00,0.00,221.00,0.00,120.00,48.00,0.00,53.00
2023,2,MQ,Envoy Air,BZN,"Bozeman, MT: Bozeman Yellowstone International",32.00,10.00,3.16,2.32,3.80,0.00,0.72,0.00,0.00,415.00,102.00,177.00,123.00,0.00,13.00
2023,2,MQ,Envoy Air,CHA,"Chattanooga, TN: Lovell Field",78.00,12.00,1.96,1.52,6.78,0.00,1.74,2.00,0.00,351.00,67.00,35.00,203.00,0.00,46.00
2023,2,MQ,Envoy Air,CHS,"Charleston, SC: Charleston AFB/International",51.00,10.00,2.26,0.44,2.24,0.00,5.06,0.00,0.00,511.00,102.00,34.00,93.00,0.00,282.00
2023,2,MQ,Envoy Air,CID,"Cedar Rapids/Iowa City, IA: The Eastern Iowa",86.00,9.00,4.06,1.00,1.97,0.00,1.97,5.00,0.00,380.00,92.00,24.00,49.00,0.00,215.00
2023,2,MQ,Envoy Air,CLE,"Cleveland, OH: Cleveland-Hopkins International",23.00,2.00,0.00,0.06,1.00,0.00,0.94,0.00,0.00,107.00,0.00,4.00,37.00,0.00,66.00
2023,2,MQ,Envoy Air,CLT,"Charlotte, NC: Charlotte Douglas International",346.00,56.00,14.86,0.26,16.03,0.00,24.85,3.00,0.00,2327.00,704.00,9.00,431.00,0.00,1183.00
2023,2,MQ,Envoy Air,CMH,"Columbus, OH: John Glenn Columbus International",234.00,50.00,14.38,4.12,13.83,0.00,17.67,2.00,0.00,2547.00,684.00,180.00,414.00,0.00,1269.00
2023,2,MQ,Envoy Air,CMI,"Champaign/Urbana, IL: University of Illinois/Willard",111.00,7.00,2.37,0.11,1.07,0.00,3.45,3.00,0.00,333.00,156.00,5.00,40.00,0.00,132.00
2023,2,MQ,Envoy Air,COS,"Colorado Springs, CO: City of Colorado Springs Municipal",3.00,1.00,0.00,0.32,0.68,0.00,0.00,1.00,0.00,72.00,0.00,23.00,49.00,0.00,0.00
2023,2,MQ,Envoy Air,COU,"Columbia, MO: Columbia Regional",108.00,13.00,3.26,0.72,4.99,0.00,4.03,2.00,1.00,870.00,125.00,68.00,236.00,0.00,441.00
2023,2,MQ,Envoy Air,CRP,"Corpus Christi, TX: Corpus Christi International",104.00,12.00,2.75,0.87,4.21,0.00,4.16,2.00,0.00,544.00,72.00,38.00,249.00,0.00,185.00
2023,2,MQ,Envoy Air,CVG,"Cincinnati, OH: Cincinnati/Northern Kentucky International",236.00,50.00,10.37,1.16,11.07,0.00,27.40,0.00,0.00,3148.00,718.00,164.00,529.00,0.00,1737.00
2023,2,MQ,Envoy Air,CWA,"Mosinee, WI: Central Wisconsin",3.00,0.00,0.00,0.00,0.00,0.00,0.00,0.00,0.00,0.00,0.00,0.00,0.00,0.00,0.00
2023,2,MQ,Envoy Air,DAB,"Daytona Beach, FL: Daytona Beach International",26.00,1.00,0.00,0.35,0.00,0.00,0.65,0.00,0.00,17.00,0.00,6.00,0.00,0.00,11.00
2023,2,MQ,Envoy Air,DAY,"Dayton, OH: James M Cox/Dayton International",86.00,9.00,1.90,1.50,4.14,0.00,1.46,2.00,0.00,381.00,81.00,63.00,174.00,0.00,63.00
2023,2,MQ,Envoy Air,DCA,"Washington, DC: Ronald Reagan Washington National",228.00,34.00,9.33,2.12,11.96,0.44,10.16,1.00,1.00,1723.00,584.00,72.00,448.00,14.00,605.00
2023,2,MQ,Envoy Air,DFW,"Dallas/Fort Worth, TX: Dallas/Fort Worth International",3155.00,447.00,112.83,29.64,156.36,2.97,145.20,125.00,1.00,28230.00,9755.00,2881.00,5035.00,108.00,10451.00
2023,2,MQ,Envoy Air,DRO,"Durango, CO: Durango La Plata County",59.00,10.00,2.40,0.35,4.63,0.00,2.62,2.00,0.00,523.00,97.00,23.00,254.00,0.00,149.00
2023,2,MQ,Envoy Air,DSM,"Des Moines, IA: Des Moines International",53.00,5.00,0.00,0.00,3.02,0.00,1.98,3.00,0.00,169.00,0.00,0.00,70.00,0.00,99.00
2023,2,MQ,Envoy Air,DTW,"Detroit, MI: Detroit Metro Wayne County",2.00,0.00,0.00,0.00,0.00,0.00,0.00,0.00,0.00,0.00,0.00,0.00,0.00,0.00,0.00
2023,2,MQ,Envoy Air,ECP,"Panama City, FL: Northwest Florida Beaches International",6.00,3.00,0.78,0.00,1.03,0.00,1.19,1.00,0.00,251.00,29.00,0.00,36.00,0.00,186.00
2023,2,MQ,Envoy Air,ELP,"El Paso, TX: El Paso International",93.00,14.00,5.61,0.00,1.83,0.00,6.56,6.00,0.00,904.00,386.00,0.00,74.00,0.00,444.00
2023,2,MQ,Envoy Air,EVV,"Evansville, IN: Evansville Regional",54.00,3.00,1.00,0.00,2.00,0.00,0.00,1.00,0.00,110.00,69.00,0.00,41.00,0.00,0.00
2023,2,MQ,Envoy Air,EWR,"Newark, NJ: Newark Liberty International",30.00,4.00,3.70,0.00,0.00,0.00,0.30,0.00,0.00,270.00,259.00,0.00,0.00,0.00,11.00
2023,2,MQ,Envoy Air,EYW,"Key West, FL: Key West International",127.00,20.00,6.10,1.60,8.12,0.00,4.18,1.00,0.00,968.00,288.00,212.00,287.00,0.00,181.00
2023,2,MQ,Envoy Air,FAR,"Fargo, ND: Hector International",113.00,19.00,8.56,0.89,6.38,0.55,2.62,6.00,2.00,1053.00,394.00,339.00,178.00,11.00,131.00
2023,2,MQ,Envoy Air,FAT,"Fresno, CA: Fresno Yosemite International",26.00,8.00,2.34,0.00,0.88,0.00,4.78,0.00,0.00,503.00,230.00,0.00,42.00,0.00,231.00
2023,2,MQ,Envoy Air,FAY,"Fayetteville, NC: Fayetteville Regional/Grannis Field",28.00,4.00,0.84,0.05,2.21,0.00,0.90,1.00,0.00,158.00,72.00,2.00,49.00,0.00,35.00
2023,2,MQ,Envoy Air,FNT,"Flint, MI: Bishop International",55.00,5.00,1.26,0.35,2.04,0.00,1.35,2.00,0.00,116.00,32.00,9.00,47.00,0.00,28.00
2023,2,MQ,Envoy Air,FSD,"Sioux Falls, SD: Joe Foss Field",10.00,3.00,0.17,0.95,0.92,0.00,0.97,2.00,0.00,95.00,4.00,19.00,14.00,0.00,58.00
